{
  "id": "front-door-hero",
  "term": "A plate the engine drew",
  "family": "product",
  "order": 33,
  "definition": "The plan sheet of the first shipped house the corpus lets the product draw, drawn live by the engine. A refused house is never shown here as if it were drawable.",
  "kind": "editorial",
  "basis": "docs/workbench.md, the front door since Phase 17: \"The hero is a real plate, and it is the plan sheet of the first shipped house the corpus lets\" the product draw, and \"where none is drawable the plate says so as a refusal\"."
}
